index,Output,Input
266,The day I invented the portal gun is the day I lost her.,"If we stay here, you'll die, along with all your memories. If you take me where I want to go she'll be there, too, won't she? Someone special you remember? Is that your memory of her out there -- between where you were on 9/11 and your favorite sports blooper? Well, that depends on who breaks first -- me or the titty. Yeah, well, tough titties. It's arousal. Yes, I'd like very much to visit the memory of you inventing your portal gun. ' Ooh, your little flappy doodles are twitching. Does that mean you're aroused, or did you just get a signal that one of your buddies found a grape? "
267,"Fine, but I'm driving.","Oh, that sounds cool. I can get what I want and you can say goodbye. The day I invented the portal gun is the day I lost her. If we stay here, you'll die, along with all your memories. If you take me where I want to go she'll be there, too, won't she? Someone special you remember? Is that your memory of her out there -- between where you were on 9/11 and your favorite sports blooper? Well, that depends on who breaks first -- me or the titty. Yeah, well, tough titties. "
268,To the day it all began and ended. The moment that changed everything.,"Where are we going? Oh, God! Oh, God! Whoa, whoa! What?! No, I'm not right. I-I was using ghoulish overkill! Ghoulish overkill, Summer! You're right! He bails on everybody! He bailed on Mom when she was a kid! He -- He bailed on tiny planet! And in case I never made this clear to you, Summer, he bailed on you. He left you to rot in a world that he ruined because he doesn't care! Because nobody's special to him, Summer, not even himself. So, if you really want your grandpa back, grab a shovel. The one that won't let you down is buried in your backyard! Because you suck! You've been keeping your lip zipped about it since Grandpa got arrested, but the fact is, you're freaking stoked to bail on him. "
269,"Yeah, I'd like to get a 10-piece McNugget and a bunch of the Szechuan sauce. Like, as much as you're allowed to give me. In 1998, they had this promotion for the Disney film ""Mulan,"" where they -- where they -- they created a new sauce for the McNuggets called Szechuan sauce, and it's delicious! And then they got rid of it, and now it's gone. This is the only place we're gonna be able to try it, is in my memory.","To the day it all began and ended. The moment that changed everything. Where are we going? Oh, God! Oh, God! Whoa, whoa! What?! No, I'm not right. I-I was using ghoulish overkill! Ghoulish overkill, Summer! You're right! He bails on everybody! He bailed on Mom when she was a kid! He -- He bailed on tiny planet! And in case I never made this clear to you, Summer, he bailed on you. He left you to rot in a world that he ruined because he doesn't care! Because nobody's special to him, Summer, not even himself. So, if you really want your grandpa back, grab a shovel. The one that won't let you down is buried in your backyard! "
270,"Okay. All right, all right.","Rick, you're doing this bit while your brain is melting. Yeah, I'd like to get a 10-piece McNugget and a bunch of the Szechuan sauce. Like, as much as you're allowed to give me. In 1998, they had this promotion for the Disney film ""Mulan,"" where they -- where they -- they created a new sauce for the McNuggets called Szechuan sauce, and it's delicious! And then they got rid of it, and now it's gone. This is the only place we're gonna be able to try it, is in my memory. To the day it all began and ended. The moment that changed everything. Where are we going? Oh, God! Oh, God! Whoa, whoa! What?! No, I'm not right. I-I was using ghoulish overkill! Ghoulish overkill, Summer! "
271,Me. I used to wear blue pants.,"Is that-- Okay. All right, all right. Rick, you're doing this bit while your brain is melting. Yeah, I'd like to get a 10-piece McNugget and a bunch of the Szechuan sauce. Like, as much as you're allowed to give me. In 1998, they had this promotion for the Disney film ""Mulan,"" where they -- where they -- they created a new sauce for the McNuggets called Szechuan sauce, and it's delicious! And then they got rid of it, and now it's gone. This is the only place we're gonna be able to try it, is in my memory. To the day it all began and ended. The moment that changed everything. Where are we going? "
272,I didn't. I did.,"When'd you make the leap to interdimensional travel? Me. I used to wear blue pants. Is that-- Okay. All right, all right. Rick, you're doing this bit while your brain is melting. Yeah, I'd like to get a 10-piece McNugget and a bunch of the Szechuan sauce. Like, as much as you're allowed to give me. In 1998, they had this promotion for the Disney film ""Mulan,"" where they -- where they -- they created a new sauce for the McNuggets called Szechuan sauce, and it's delicious! And then they got rid of it, and now it's gone. This is the only place we're gonna be able to try it, is in my memory. "
273,Yeah. That's the three lines of math that separates my life as a man from my life as an unfeeling ghost.,"Whoa. I-Is that it, the portal gun? Carry the three, add a two. I got it. I fucking got it. Wow. This sauce is fucking amazing. You said it was promoting a movie? Nooooooo! Come on, girls! The ice cream's gonna melt. Boo-nah? "
274,"Nope, they cannot.","Yeah! Thanks, Rick. I'll try to remember to shut off the brainalyzer. Actually, I think it shuts off automatically once your brain is liquid. Don't know, don't care. Pull me out.  Hey, pull me out! Can you hear me? Awesome-possum.  Mission Control, you getting this? Yeah. That's the three lines of math that separates my life as a man from my life as an unfeeling ghost. Whoa. I-Is that it, the portal gun? Carry the three, add a two. I got it. I fucking got it. Wow. This sauce is fucking amazing. You said it was promoting a movie? "
275,"Because the code you just uploaded wasn't actually my portal-gun formula, it was a virus giving me full control over the brainalyzer.","Why not? Nope, they cannot. Yeah! Thanks, Rick. I'll try to remember to shut off the brainalyzer. Actually, I think it shuts off automatically once your brain is liquid. Don't know, don't care. Pull me out.  Hey, pull me out! Can you hear me? Awesome-possum.  Mission Control, you getting this? Yeah. That's the three lines of math that separates my life as a man from my life as an unfeeling ghost. Whoa. I-Is that it, the portal gun? "
276,"True, but you can alter anything you want about a totally fabricated origin story.","What are you talking about? This is a memory. Y-You can't alter details of a memory. Because the code you just uploaded wasn't actually my portal-gun formula, it was a virus giving me full control over the brainalyzer. Why not? Nope, they cannot. Yeah! Thanks, Rick. I'll try to remember to shut off the brainalyzer. Actually, I think it shuts off automatically once your brain is liquid. Don't know, don't care. Pull me out.  Hey, pull me out! Can you hear me? Awesome-possum.  Mission Control, you getting this? "
277,"Mission accomplished, boys. Pull me out.","It's a trap! Abort! I'm still in his Shoney's! Repeat -- we never left his Shoney's! True, but you can alter anything you want about a totally fabricated origin story. What are you talking about? This is a memory. Y-You can't alter details of a memory. Because the code you just uploaded wasn't actually my portal-gun formula, it was a virus giving me full control over the brainalyzer. Why not? Nope, they cannot. "
278,"Okay, have fun in what's left of my brain. I'm gonna transfer to yours. Oh, there's not enough room for all my genius, so I'm leaving you with my fear of wicker furniture, my desire to play the trumpet, my tentative plans to purchase a hat, and six years of improv workshops. Comedy comes in threes.","Mission accomplished, boys. Pull me out. It's a trap! Abort! I'm still in his Shoney's! Repeat -- we never left his Shoney's! True, but you can alter anything you want about a totally fabricated origin story. What are you talking about? This is a memory. Y-You can't alter details of a memory. Because the code you just uploaded wasn't actually my portal-gun formula, it was a virus giving me full control over the brainalyzer. Why not? "
279,Duh!,"Grandpa Rick! All right, calm down! We have his Summer as a hostage. Obviously, I get her. You guys play Rick, Laser, Scissors for the Morty. Oh, yeah? If you think my Rick's dead, he's alive. And if you think you're safe, he's coming for you! Let's not suck the ghost of his dick too hard. He was a terrorist, and now he's dead. What? N-No, I don't want to see your Pog collection. I don't renounce Rick, and I never have. I was just trying to protect my sister. I wanted you to have a normal life. That's something you can't have when Rick shows up. Everything real turns fake. Everything right is wrong. All you know is that you know nothing and he knows everything. And, well -- well, he's not a villain, Summer, but he shouldn't be your hero. He's more like a demon or a super fucked up god. Morty? "
280,"Morty, take this. You're gonna need it later.","Rick! You're alive! Duh! Grandpa Rick! All right, calm down! We have his Summer as a hostage. Obviously, I get her. You guys play Rick, Laser, Scissors for the Morty. Oh, yeah? If you think my Rick's dead, he's alive. And if you think you're safe, he's coming for you! "
281,What -- What's this supposed to accomplish? We have infinite grandkids. You're trying to use Disney bucks at a Caesar's Palace here.,"That's enough, Rick. Morty, take this. You're gonna need it later. Rick! You're alive! Duh! Grandpa Rick! "
282,"I came to kill you, bro. That's not even my original Summer.","You're a rogue Rick -- irrational, passionate. You love your grandkids. You came to rescue them. That's a bluff. He's bluffing, sir. He loves me. What -- What's this supposed to accomplish? We have infinite grandkids. You're trying to use Disney bucks at a Caesar's Palace here. That's enough, Rick. Morty, take this. You're gonna need it later. Rick! "
283,"20 yards, nine-gauge plasma pistol, My first shot would liquify her insides and injure you, second shot adds recoil. The risk to me is minimized if I wait for you to shoot her, which I'm encouraging you to do.","Why not shoot through her? R-Rick? Oh, my God. He's not bluffing. He's not bluffing! I came to kill you, bro. That's not even my original Summer. You're a rogue Rick -- irrational, passionate. You love your grandkids. You came to rescue them. That's a bluff. He's bluffing, sir. He loves me. "
284,"Or let her go, which I will reward with a quicker death.","What the fuck? 20 yards, nine-gauge plasma pistol, My first shot would liquify her insides and injure you, second shot adds recoil. The risk to me is minimized if I wait for you to shoot her, which I'm encouraging you to do. Why not shoot through her? R-Rick? Oh, my God. He's not bluffing. He's not bluffing! I came to kill you, bro. That's not even my original Summer. "
285,"Because it's incentive for you to give me my cleanest shot, which will be your least painful death. But if you want to die slower than that, I'm super into it. All you got to do to get that started is kill the girl.","Because you love her! Or let her go, which I will reward with a quicker death. What the fuck? 20 yards, nine-gauge plasma pistol, My first shot would liquify her insides and injure you, second shot adds recoil. The risk to me is minimized if I wait for you to shoot her, which I'm encouraging you to do. Why not shoot through her? R-Rick? "
286,"Not an issue, sweetie.","I hate you! Because it's incentive for you to give me my cleanest shot, which will be your least painful death. But if you want to die slower than that, I'm super into it. All you got to do to get that started is kill the girl. Because you love her! Or let her go, which I will reward with a quicker death. What the fuck? 20 yards, nine-gauge plasma pistol, My first shot would liquify her insides and injure you, second shot adds recoil. The risk to me is minimized if I wait for you to shoot her, which I'm encouraging you to do. "
287,"Morty, I know you're too stupid to get this, but you're really fuckin' this up right now.","That's enough! Drop the gun, Rick! Not an issue, sweetie. I hate you! Because it's incentive for you to give me my cleanest shot, which will be your least painful death. But if you want to die slower than that, I'm super into it. All you got to do to get that started is kill the girl. Because you love her! Or let her go, which I will reward with a quicker death. "
288,"I wasn't gonna let her die, you fuckin' moron!","I'm not letting you let my sister die! Drop the gun! Morty, I know you're too stupid to get this, but you're really fuckin' this up right now. That's enough! Drop the gun, Rick! Not an issue, sweetie. I hate you! Because it's incentive for you to give me my cleanest shot, which will be your least painful death. But if you want to die slower than that, I'm super into it. All you got to do to get that started is kill the girl. "
289,The point is he thought I was going to.,"Aww. Ha! I wasn't gonna let her die, you fuckin' moron! I'm not letting you let my sister die! Drop the gun! Morty, I know you're too stupid to get this, but you're really fuckin' this up right now. That's enough! Drop the gun, Rick! "
290,"You're a serious fuckin' idiot, Morty! You basically killed us all! You're the worst! You're as dumb as a bag of sand.","Morty, you fucking idiot! I totally did, by the way. You're a fucking moron, Morty. The point is he thought I was going to. Aww. Ha! I wasn't gonna let her die, you fuckin' moron! "
291,"Good job, Morty. Let's go, kids.","That was amazing, Morty. Oh, my God. Wow. Okay, let's wrap this- Morty, we just got him back! Who's stupid now, bitch?! You're a serious fuckin' idiot, Morty! You basically killed us all! You're the worst! You're as dumb as a bag of sand. Morty, you fucking idiot! I totally did, by the way. You're a fucking moron, Morty. "
292,Oldest Rick trick in the book.,"What?! What happened? Good job, Morty. Let's go, kids. That was amazing, Morty. Oh, my God. Wow. Okay, let's wrap this- Morty, we just got him back! Who's stupid now, bitch?! You're a serious fuckin' idiot, Morty! You basically killed us all! You're the worst! You're as dumb as a bag of sand. "
293,Not until I finish what I started. And that is how you get level-nine access without a password.,"Can't we just portal home? Ha, yeah. G-Good thing I saw that note. ""Fake gun, shoot me in standoff."" Brilliant. Oldest Rick trick in the book. What?! What happened? Good job, Morty. Let's go, kids. "
294,"Employee of the month, ladies and gentlemen.","Not until I finish what I started. And that is how you get level-nine access without a password. Can't we just portal home? Ha, yeah. G-Good thing I saw that note. ""Fake gun, shoot me in standoff."" Brilliant. Oldest Rick trick in the book. What?! What happened? "
295,Destroying the  galactic government.,"So, what are you doing with level-nine access anyways? Employee of the month, ladies and gentlemen. Not until I finish what I started. And that is how you get level-nine access without a password. Can't we just portal home? Ha, yeah. G-Good thing I saw that note. ""Fake gun, shoot me in standoff."" Brilliant. "
296,"Good pitches, kids. I'm almost proud. But watch closely as Grandpa topples an empire by changing a one to a zero.","Ooh, or -- or reprogram their military portals to disintegrate their entire space fleet? Are you going to set all their nukes to target each other? Destroying the  galactic government. So, what are you doing with level-nine access anyways? Employee of the month, ladies and gentlemen. Not until I finish what I started. And that is how you get level-nine access without a password. "
297,Guess who dismantled the government?,"Just each other, and I'll never let you go. And I'm so sorry I ever did this to us. Look, I-I'm not proud to share this, but the truth is, I just kept crawling, and it kept working.  Oh, I'm glad you're okay. Are we ever going to stop paying for indulging your father? Our children, our planet, our jobs? Is there anything left to lose? Are you okay? The galactic government collapsed. Jerry, what the hell is happening?! No longer will the insects have domain over surface world! "
298,"I never will, baby.","Please don't leave me again. Guess who dismantled the government? Just each other, and I'll never let you go. And I'm so sorry I ever did this to us. Look, I-I'm not proud to share this, but the truth is, I just kept crawling, and it kept working.  Oh, I'm glad you're okay. Are we ever going to stop paying for indulging your father? Our children, our planet, our jobs? Is there anything left to lose? Are you okay? The galactic government collapsed. "
299,"Jerry, is there any light beer left? It's insane what you miss in prison.","I was right. He turned himself in on purpose. It was all part of his plan! I never will, baby. Please don't leave me again. Guess who dismantled the government? Just each other, and I'll never let you go. And I'm so sorry I ever did this to us. Look, I-I'm not proud to share this, but the truth is, I just kept crawling, and it kept working.  Oh, I'm glad you're okay. Are we ever going to stop paying for indulging your father? Our children, our planet, our jobs? Is there anything left to lose? "
300,"No, you're right. Where's the vodka?","Um..okay. No. No, no, no. Foot down time. Jerry, is there any light beer left? It's insane what you miss in prison. I was right. He turned himself in on purpose. It was all part of his plan! I never will, baby. Please don't leave me again. Guess who dismantled the government? "
301,"Seems like you guys need some privacy. I'll, uh -- I'll be in the garage.","Beth, it's him or me! No, you're right. Where's the vodka? Um..okay. No. No, no, no. Foot down time. Jerry, is there any light beer left? It's insane what you miss in prison. I was right. He turned himself in on purpose. It was all part of his plan! I never will, baby. "
302,"What the fuck? Not cool, Jerry! A man's garage is his castle.","Seems like you guys need some privacy. I'll, uh -- I'll be in the garage. Beth, it's him or me! No, you're right. Where's the vodka? Um..okay. No. No, no, no. Foot down time. Jerry, is there any light beer left? It's insane what you miss in prison. I was right. He turned himself in on purpose. It was all part of his plan! "
303,"Oh, I-I'm sorry to hear that, sweetie. I hope I had nothing to do with that.","Jerry's going to spend some time divorced. What the fuck? Not cool, Jerry! A man's garage is his castle. Seems like you guys need some privacy. I'll, uh -- I'll be in the garage. Beth, it's him or me! No, you're right. Where's the vodka? Um..okay. No. No, no, no. Foot down time. "
304,For everybody.,"Oh, God, Dad, that is not your burden to bear. I feel terrible that I misjudged you. This is gonna be good for Jerry. Oh, I-I'm sorry to hear that, sweetie. I hope I had nothing to do with that. Jerry's going to spend some time divorced. What the fuck? Not cool, Jerry! A man's garage is his castle. Seems like you guys need some privacy. I'll, uh -- I'll be in the garage. Beth, it's him or me! "
305,"Not so fast, Morty. You heard your mom. We've got adventures to go on, Morty -- just you and me -- and sometimes your sister and sometimes your mom, but never your dad. You want to know why, Morty? Because he crossed me.","Geez! Are my parents seriously gonna get divorced? All right, Rick, I'm gonna go to my -- Oh, my God. Nancy says they're drawing and quartering aliens in the school courtyard, and it technically counts as patriotism. I better tend to Jerry before he changes his mind and doesn't move out. I will leave you two to your adventures. For everybody. For everybody. Oh, God, Dad, that is not your burden to bear. I feel terrible that I misjudged you. This is gonna be good for Jerry. "
306,"Oh, it gets darker, Morty. Welcome to the darkest year of our adventures. First thing that's different -- no more Dad, Morty.","Okay, take it easy, Rick. T-T-That's dark. Not so fast, Morty. You heard your mom. We've got adventures to go on, Morty -- just you and me -- and sometimes your sister and sometimes your mom, but never your dad. You want to know why, Morty? Because he crossed me. Geez! Are my parents seriously gonna get divorced? All right, Rick, I'm gonna go to my -- Oh, my God. Nancy says they're drawing and quartering aliens in the school courtyard, and it technically counts as patriotism. I better tend to Jerry before he changes his mind and doesn't move out. I will leave you two to your adventures. For everybody. "
307,"He threatened to turn me in to the government, so I made him and the government go away.","Oh, geez. Oh, it gets darker, Morty. Welcome to the darkest year of our adventures. First thing that's different -- no more Dad, Morty. Okay, take it easy, Rick. T-T-That's dark. Not so fast, Morty. You heard your mom. We've got adventures to go on, Morty -- just you and me -- and sometimes your sister and sometimes your mom, but never your dad. You want to know why, Morty? Because he crossed me. Geez! Are my parents seriously gonna get divorced? All right, Rick, I'm gonna go to my -- Oh, my God. Nancy says they're drawing and quartering aliens in the school courtyard, and it technically counts as patriotism. "
308,I've replaced them both as the de facto patriarch of your family and your universe. Your mom wouldn't have accepted me if I came home -,"Oh, fuck. He threatened to turn me in to the government, so I made him and the government go away. Oh, geez. Oh, it gets darker, Morty. Welcome to the darkest year of our adventures. First thing that's different -- no more Dad, Morty. Okay, take it easy, Rick. T-T-That's dark. Not so fast, Morty. You heard your mom. We've got adventures to go on, Morty -- just you and me -- and sometimes your sister and sometimes your mom, but never your dad. You want to know why, Morty? Because he crossed me. "
309,"- without you and your sister, so now you know the real reason I rescued you. Oh! I just took over the family, Morty, and if you tell your mom -","Oh, man. I've replaced them both as the de facto patriarch of your family and your universe. Your mom wouldn't have accepted me if I came home - Oh, fuck. He threatened to turn me in to the government, so I made him and the government go away. Oh, geez. Oh, it gets darker, Morty. Welcome to the darkest year of our adventures. First thing that's different -- no more Dad, Morty. "
310,"- or sister I said any of this, I'll deny it -","Oh, man. - without you and your sister, so now you know the real reason I rescued you. Oh! I just took over the family, Morty, and if you tell your mom - Oh, man. I've replaced them both as the de facto patriarch of your family and your universe. Your mom wouldn't have accepted me if I came home - Oh, fuck. He threatened to turn me in to the government, so I made him and the government go away. "
311,"- and they'll take my side because I'm a hero, Morty. And now you're gonna have to go -","You're gonna deny it. - or sister I said any of this, I'll deny it - Oh, man. - without you and your sister, so now you know the real reason I rescued you. Oh! I just took over the family, Morty, and if you tell your mom - Oh, man. I've replaced them both as the de facto patriarch of your family and your universe. Your mom wouldn't have accepted me if I came home - "
312,"- and do whatever I say, Morty, forever! And I'll -- I'll go out and I'll find some more of that ""Mulan"" Szechuan teriyaki dipping sauce, Morty. -","Oh. - and they'll take my side because I'm a hero, Morty. And now you're gonna have to go - You're gonna deny it. - or sister I said any of this, I'll deny it - Oh, man. - without you and your sister, so now you know the real reason I rescued you. Oh! I just took over the family, Morty, and if you tell your mom - "
313,"- Because that's -- that's what this is all about, Morty.","What are you talking about? - and do whatever I say, Morty, forever! And I'll -- I'll go out and I'll find some more of that ""Mulan"" Szechuan teriyaki dipping sauce, Morty. - Oh. - and they'll take my side because I'm a hero, Morty. And now you're gonna have to go - You're gonna deny it. - or sister I said any of this, I'll deny it - "
314,"That's my one-armed man! I'm not driven by avenging my dead family, Morty! That was fake. I-I-I'm driven by finding that McNugget sauce.","Szechuan? - Because that's -- that's what this is all about, Morty. What are you talking about? - and do whatever I say, Morty, forever! And I'll -- I'll go out and I'll find some more of that ""Mulan"" Szechuan teriyaki dipping sauce, Morty. - Oh. - and they'll take my side because I'm a hero, Morty. And now you're gonna have to go - "
315,"I want that ""Mulan"" McNugget sauce, Morty! That's my series arc, Morty.","McNuggets? That's my one-armed man! I'm not driven by avenging my dead family, Morty! That was fake. I-I-I'm driven by finding that McNugget sauce. Szechuan? - Because that's -- that's what this is all about, Morty. What are you talking about? - and do whatever I say, Morty, forever! And I'll -- I'll go out and I'll find some more of that ""Mulan"" Szechuan teriyaki dipping sauce, Morty. - "
316,"If it takes nine seasons, I want my McNugget dipping sauce, Szechuan sauce, Morty.","What the hell? I want that ""Mulan"" McNugget sauce, Morty! That's my series arc, Morty. McNuggets? That's my one-armed man! I'm not driven by avenging my dead family, Morty! That was fake. I-I-I'm driven by finding that McNugget sauce. Szechuan? - Because that's -- that's what this is all about, Morty. "
