index,Output,Input
77,"I'm sorry, Morty. It's a bummer. In reality, you're as dumb as they come and I needed those seeds real bad, and I had to give them up just to get your parents off my back, so now we're gonna have to go get more adventures.  And then we're gonna go on even more adventures after that, Morty and you're gonna keep your mouth shut about it, Morty, because the world is full of idiots that don't understand what's important, and they'll tear us apart, Morty but if you stick with me, I'm gonna accomplish great things, Morty, and you're gonna be part of them, and together, we're gonna run around, Morty. We're gonna do all kinds of wonderful things, Morty. Just you and me, Morty. The outside world is our enemy, Morty. We're the only friends we've got, Morty. It's just Rick and Morty. Rick and Morty and their adventures, Morty. Rick and Morty forever and forever. Morty's things. Me and Rick and Morty running around, and Rick and Morty time. All day long, forever. All a hundred days. Rick and Morty forever 100 times. Over and over, rickandmortyadventures.com. All 100 years. Every minute, rickandmorty.com.","Ohh, man.  Oh, geez! Ohh. Yeah, and once those seeds wear off, you're gonna lose most of your motor skills, and you're also gonna lose a significant amount of brain functionality for 72 hours, Morty. Aw, man. Full disclosure, Morty it's not. Temporary superintelligence is just a side effect of the mega seeds dissolving in your rectal cavity. Holy cow, Rick. I didn't know hanging out with you was making me smarter. You know what? Okay. "
78,"Morty, come on. I need your help tonight.","Don't praise him now, Morty! He just peed on the carpet! Bad dog! Bad! Oh, he he didn't mean it, dad. Did you, snuffles? You're a good boy. Your idiot dog! What's wrong? Oh, my God. Are you kidding me?! Come on! "
79,"I thought the whole point of having a dog was to feel superior, Jerry. If I were you, I wouldn't pull that thread. Come on, Morty.","Hey, wait, hold on a second, Rick. You wouldn't by any chance have some sort of crazy science thing you could whip up that might help make this dog a little smarter, would you? Morty, come on. I need your help tonight. Don't praise him now, Morty! He just peed on the carpet! Bad dog! Bad! Oh, he he didn't mean it, dad. Did you, snuffles? You're a good boy. Your idiot dog! What's wrong? "
80,"Boy, you really got me up against a wall this time, Jerry.","Aw, man! Ha-ha! Listen, Rick, if you're gonna stay here rent-free and use my son for your stupid science, the least you could do is put a little bit of it to use for the family. You make that dog smart or Morty's grounded! I thought the whole point of having a dog was to feel superior, Jerry. If I were you, I wouldn't pull that thread. Come on, Morty. Hey, wait, hold on a second, Rick. You wouldn't by any chance have some sort of crazy science thing you could whip up that might help make this dog a little smarter, would you? Morty, come on. I need your help tonight. "
81,"All right, Ruffles What's his name?","Boy, you really got me up against a wall this time, Jerry. Aw, man! Ha-ha! Listen, Rick, if you're gonna stay here rent-free and use my son for your stupid science, the least you could do is put a little bit of it to use for the family. You make that dog smart or Morty's grounded! I thought the whole point of having a dog was to feel superior, Jerry. If I were you, I wouldn't pull that thread. Come on, Morty. Hey, wait, hold on a second, Rick. You wouldn't by any chance have some sort of crazy science thing you could whip up that might help make this dog a little smarter, would you? "
82,"Snuffles, shake.","Snuffles. All right, Ruffles What's his name? Boy, you really got me up against a wall this time, Jerry. Aw, man! Ha-ha! Listen, Rick, if you're gonna stay here rent-free and use my son for your stupid science, the least you could do is put a little bit of it to use for the family. You make that dog smart or Morty's grounded! "
83,Roll over.,"Snuffles, shake. Snuffles. All right, Ruffles What's his name? Boy, you really got me up against a wall this time, Jerry. Aw, man! Ha-ha! "
84,Go to the bathroom.,"Roll over. Snuffles, shake. Snuffles. All right, Ruffles What's his name? Boy, you really got me up against a wall this time, Jerry. Aw, man! "
85,"Yeah, you're at the top of your game now, Jerry. Have fun. Come on, Morty.","No way. Holy crap! Go to the bathroom. Roll over. Snuffles, shake. Snuffles. "
86,"Yeah, Morty, if you like that, boy, you're you're really going to flip your lid over this one.","That was fantastic, Rick! Yeah, you're at the top of your game now, Jerry. Have fun. Come on, Morty. No way. Holy crap! Go to the bathroom. Roll over. "
87,"It's a device, Morty, that when you put it in your ear, you can enter people's dreams, Morty. It's just like that movie that you keep crowing about.","W-w-w-what is it? Yeah, Morty, if you like that, boy, you're you're really going to flip your lid over this one. That was fantastic, Rick! Yeah, you're at the top of your game now, Jerry. Have fun. Come on, Morty. No way. Holy crap! "
88,"That's right, Morty. This is gonna be a lot like that, except, you know, it's gonna may--be make sense.","You talking about ""Inception""? It's a device, Morty, that when you put it in your ear, you can enter people's dreams, Morty. It's just like that movie that you keep crowing about. W-w-w-what is it? Yeah, Morty, if you like that, boy, you're you're really going to flip your lid over this one. That was fantastic, Rick! Yeah, you're at the top of your game now, Jerry. Have fun. Come on, Morty. "
89,"You don't have to try to impress me, Morty. Listen, tonight we're gonna go into the home of your math teacher, Mr. Goldenfold, and we're gonna incept the idea in his brain to give you A's in math, Morty. That way you can, you know, y-you're gonna help me with my science, Morty, all the time.","""Inception"" made sense. That's right, Morty. This is gonna be a lot like that, except, you know, it's gonna may--be make sense. You talking about ""Inception""? It's a device, Morty, that when you put it in your ear, you can enter people's dreams, Morty. It's just like that movie that you keep crowing about. W-w-w-what is it? Yeah, Morty, if you like that, boy, you're you're really going to flip your lid over this one. "
90,"Are you listening to me, Morty? Homework is stupid. The whole point is to get less of it.","Geez, Rick, in the time it took you to make this thing, couldn't you have just, you know, helped me with my homework? You don't have to try to impress me, Morty. Listen, tonight we're gonna go into the home of your math teacher, Mr. Goldenfold, and we're gonna incept the idea in his brain to give you A's in math, Morty. That way you can, you know, y-you're gonna help me with my science, Morty, all the time. ""Inception"" made sense. That's right, Morty. This is gonna be a lot like that, except, you know, it's gonna may--be make sense. You talking about ""Inception""? It's a device, Morty, that when you put it in your ear, you can enter people's dreams, Morty. It's just like that movie that you keep crowing about. "
91,"Come on, let's just get over there and deal with this thing. W-we're gonna incept your teacher. You're frustrating me.","Are you listening to me, Morty? Homework is stupid. The whole point is to get less of it. Geez, Rick, in the time it took you to make this thing, couldn't you have just, you know, helped me with my homework? You don't have to try to impress me, Morty. Listen, tonight we're gonna go into the home of your math teacher, Mr. Goldenfold, and we're gonna incept the idea in his brain to give you A's in math, Morty. That way you can, you know, y-you're gonna help me with my science, Morty, all the time. ""Inception"" made sense. That's right, Morty. This is gonna be a lot like that, except, you know, it's gonna may--be make sense. You talking about ""Inception""? "
92,Uh-oh! Spoilers!,"You don't know me! ' Nice, Mrs. Pancakes real nice. You don't know me! Come on, let's just get over there and deal with this thing. W-we're gonna incept your teacher. You're frustrating me. Are you listening to me, Morty? Homework is stupid. The whole point is to get less of it. Geez, Rick, in the time it took you to make this thing, couldn't you have just, you know, helped me with my homework? "
93,I'm a full season behind.,"Uh-oh! Spoilers! You don't know me! ' Nice, Mrs. Pancakes real nice. You don't know me! Come on, let's just get over there and deal with this thing. W-we're gonna incept your teacher. You're frustrating me. Are you listening to me, Morty? Homework is stupid. The whole point is to get less of it. "
94,"It's about to get a whole lot weirder, Morty.","Wow, Rick, I can't believe we're sitting around, standing around in Mr. Goldenfold's house. It's really weird. I'm a full season behind. Uh-oh! Spoilers! You don't know me! ' Nice, Mrs. Pancakes real nice. You don't know me! "
95,"All right, Morty, time to make our move.","Oh, I think you've had enough, sir. I'll take two. Wheat thins. Wheat thins. It's about to get a whole lot weirder, Morty. Wow, Rick, I can't believe we're sitting around, standing around in Mr. Goldenfold's house. It's really weird. I'm a full season behind. "
96,Allahu  akbar! We're gonna take control of this plane! We're gonna 9/11 it unless Morty Smith gets better grades in math!,"You better stop with that. Oh, jiggle it now. No, you didn't. Make it bounce. All right, Morty, time to make our move. Oh, I think you've had enough, sir. "
97,"Hey! I said nobody move, buddy!","Allahu  akbar! We're gonna take control of this plane! We're gonna 9/11 it unless Morty Smith gets better grades in math! You better stop with that. Oh, jiggle it now. No, you didn't. Make it bounce. All right, Morty, time to make our move. "
98,"Take cover, Morty!","The name's not buddy. It's Goldenfold. Nice to wheat you! Hey! I said nobody move, buddy! Allahu  akbar! We're gonna take control of this plane! We're gonna 9/11 it unless Morty Smith gets better grades in math! You better stop with that. Oh, jiggle it now. No, you didn't. "
99,"Goldenfold's got more control here than I anticipated. I mean, the guy teaches high-school math.  I didn't take him for an active dreamer. We've got to take him out so he wakes up, Morty but we can't get killed. If you get killed in someone else's dream, you die for real, Morty.","Ooohhh! AAAAAAAAAAAAAAAAAAAAAAAHHHHHHHHHHHHHHHH!!!!!!!!!!!!!!!!!!! Take cover, Morty! The name's not buddy. It's Goldenfold. Nice to wheat you! Hey! I said nobody move, buddy! Allahu  akbar! We're gonna take control of this plane! We're gonna 9/11 it unless Morty Smith gets better grades in math! "
100,"Don't be a baby! You avoid getting shot in real life all the time, Morty. Just do the same thing here, and we'll be fine!","What?! Are you kidding me?! Ohhhhhh! Goldenfold's got more control here than I anticipated. I mean, the guy teaches high-school math.  I didn't take him for an active dreamer. We've got to take him out so he wakes up, Morty but we can't get killed. If you get killed in someone else's dream, you die for real, Morty. Ooohhh! AAAAAAAAAAAAAAAAAAAAAAAHHHHHHHHHHHHHHHH!!!!!!!!!!!!!!!!!!! Take cover, Morty! The name's not buddy. It's Goldenfold. Nice to wheat you! "
101,"Goldenfold, we're coming out! We just want to talk!","Hmm? I should call Bob Saget. Is that still a thing? He's saying ""I love Obama"".  So cute! I'm posting this  online, like, right now. Ooooyayawawa! Aw, he's saying ""I love lasagna"". Aaaawwaaaaawaawa! "
102,Because we're both rational adults that don't want anything bad to happen. And because I have a human shield.,"Goldenfold, we're coming out! We just want to talk! Hmm? I should call Bob Saget. Is that still a thing? He's saying ""I love Obama"".  So cute! I'm posting this  online, like, right now. Ooooyayawawa! Aw, he's saying ""I love lasagna"". "
103,"Oh, no, Morty. His subconscious is panicking.","Mrs. Pancakes! AAAAAAAAHHHH!!!!! Because we're both rational adults that don't want anything bad to happen. And because I have a human shield. Goldenfold, we're coming out! We just want to talk! Hmm? I should call Bob Saget. Is that still a thing? He's saying ""I love Obama"".  So cute! I'm posting this  online, like, right now. "
104,Whoa! Whoa! Whoa! Whoooooaaaa! Whoa! Whoa! Whoooooaaaa!,"Oh, no, Morty. His subconscious is panicking. Mrs. Pancakes! AAAAAAAAHHHH!!!!! Because we're both rational adults that don't want anything bad to happen. And because I have a human shield. Goldenfold, we're coming out! We just want to talk! Hmm? I should call Bob Saget. Is that still a thing? "
105,"Relax, Morty. Look! Mrs. Pancakes has a parachute. Come on!","AAAAAAAAAAAAAAAAAAAAAAAAHHHHHHHHHH!!!!!!!!!! Whooooa! Whoooooooa! Whoa! Whooooooooaaaaa! Whoa! Whoa! Whoa! Whoooooaaaa! Whoa! Whoa! Whoooooaaaa! Oh, no, Morty. His subconscious is panicking. Mrs. Pancakes! AAAAAAAAHHHH!!!!! Because we're both rational adults that don't want anything bad to happen. And because I have a human shield. "
106,"Pretty concise, Morty. Looks like we've merely prolonged the inevitable. That's it, Morty! Prolonging the inevitable! Listen, if we go into Mrs. Pancakes' dream, everything will go 100 times slower, Morty. That'll buy us some time to figure this out!","Oh, no, Rick, look! Goldenfold landed the plane, and he's created a  mechanical arm to pluck Mrs. Pancakes out of the air while he lets us fall - into a giant vat of lava! Hey, you don't know me! Relax, Morty. Look! Mrs. Pancakes has a parachute. Come on! AAAAAAAAAAAAAAAAAAAAAAAAHHHHHHHHHH!!!!!!!!!! Whooooa! Whoooooooa! Whoa! Whooooooooaaaaa! Whoa! Whoa! Whoa! Whoooooaaaa! Whoa! Whoa! Whoooooaaaa! "
107,"All right, let's go.","You don't know m- Pretty concise, Morty. Looks like we've merely prolonged the inevitable. That's it, Morty! Prolonging the inevitable! Listen, if we go into Mrs. Pancakes' dream, everything will go 100 times slower, Morty. That'll buy us some time to figure this out! Oh, no, Rick, look! Goldenfold landed the plane, and he's created a  mechanical arm to pluck Mrs. Pancakes out of the air while he lets us fall - into a giant vat of lava! Hey, you don't know me! Relax, Morty. Look! Mrs. Pancakes has a parachute. Come on! AAAAAAAAAAAAAAAAAAAAAAAAHHHHHHHHHH!!!!!!!!!! "
108,"Don't judge, Morty.","Oh, man, Rick, this is pretty weird. All right, let's go. You don't know m- Pretty concise, Morty. Looks like we've merely prolonged the inevitable. That's it, Morty! Prolonging the inevitable! Listen, if we go into Mrs. Pancakes' dream, everything will go 100 times slower, Morty. That'll buy us some time to figure this out! Oh, no, Rick, look! Goldenfold landed the plane, and he's created a  mechanical arm to pluck Mrs. Pancakes out of the air while he lets us fall - into a giant vat of lava! Hey, you don't know me! "
109,"Whoa, whoa, Morty, the trick to incepting is making people think they came up with the idea. Listen to me. If we're gonna incept Mrs. Pancakes, we have to blend. I'll talk to you after lunch.","Okay. All right, well Look, Mrs. Pancakes is right over there. I'll just go ask her to tell goldenfold not to kill us when she wakes up. Don't judge, Morty. Oh, man, Rick, this is pretty weird. All right, let's go. You don't know m- Pretty concise, Morty. Looks like we've merely prolonged the inevitable. That's it, Morty! Prolonging the inevitable! Listen, if we go into Mrs. Pancakes' dream, everything will go 100 times slower, Morty. That'll buy us some time to figure this out! "
110,"Whoa, whoa, whoa! What's the matter with you, Morty? Calm down! You're kind of killing the vibe in here.","Ohh! Oh! Gross! Gross! Hey, there, stranger. What do you think of these things? Whoa! No, I'm okay. No, thanks! I'm sorry. No, no. "
111,"Time to go another dream deep, Morty!","Can you blame him? Come on, old man, little boy. Let's make an inter-generational sandwich. It's Summer! Aw, geez. Whoa, whoa, whoa! What's the matter with you, Morty? Calm down! You're kind of killing the vibe in here. Ohh! Oh! Gross! Gross! Hey, there, stranger. What do you think of these things? Whoa! "
112,"Geez, I don't know, Morty. Wha-what do you want from me?","What the hell? Why would Mr. Goldenfold's dream version of Mrs. Time to go another dream deep, Morty! Can you blame him? Come on, old man, little boy. Let's make an inter-generational sandwich. It's Summer! Aw, geez. Whoa, whoa, whoa! What's the matter with you, Morty? Calm down! You're kind of killing the vibe in here. Ohh! Oh! Gross! Gross! "
113,"Oh, here we go!","Welcome to your nightmare, bitch! RAAAAAWWWRRR! Geez, I don't know, Morty. Wha-what do you want from me? What the hell? Why would Mr. Goldenfold's dream version of Mrs. Time to go another dream deep, Morty! Can you blame him? Come on, old man, little boy. Let's make an inter-generational sandwich. It's Summer! Aw, geez. "
114,Looks like some sort of legally safe knock-off of an '80s horror character with miniature swords for fingers instead of knives.,"Ooooooohhhhh! Holy crap! Oh, here we go! Welcome to your nightmare, bitch! RAAAAAWWWRRR! Geez, I don't know, Morty. Wha-what do you want from me? What the hell? Why would Mr. Goldenfold's dream version of Mrs. Time to go another dream deep, Morty! "
115,"Holy crap! We have to escape into someone else's dreams, Morty!","Aw! Oh, my God! He recognizes the other dogs on TV. I don't know. It's Indian giving. Why not? Whoa, dad, you can't, like, endow a creature with sentience and then rip it away. Okay, yeah. I get what Beth was talking about. Fun's over. Snuffles want to be understood. Snuffles need to be understood. "
116,The little girl!,"Oh, man, oh, man, oh, man! Holy crap! We have to escape into someone else's dreams, Morty! Aw! Oh, my God! He recognizes the other dogs on TV. I don't know. It's Indian giving. Why not? Whoa, dad, you can't, like, endow a creature with sentience and then rip it away. "
117,"Are you kidding me? This again? Oh, man, it looks like we've hit dream bedrock here, Morty.","Huh? The little girl! Oh, man, oh, man, oh, man! Holy crap! We have to escape into someone else's dreams, Morty! Aw! Oh, my God! He recognizes the other dogs on TV. I don't know. It's Indian giving. "
118,"Holy crap, Morty. He can travel through dreams. He can travel through dreams! We're so screwed!","Ohhhh! Nothing but fear from here on out, bitch! Oh, geez, Rick. W-w-whoa, this isn't good. Are you kidding me? This again? Oh, man, it looks like we've hit dream bedrock here, Morty. Huh? The little girl! "
119,What are we here for again? Incepting? We're trying to incept-,"You will walk when it is time to walk. Yeah. Totally. Let's go. Jerry, come to rub my face in urine again? Hey. Oh, wow. Okay, is is is everything okay in here? Uhhh ... Tell me, Summer, if a human was born with stumpy legs, would they breed it with another deformed human and put their children on display like the dachshund? "
120,"Oh, yeah.","We're trying to incept me to get an ""A"" in math? What are we here for again? Incepting? We're trying to incept- You will walk when it is time to walk. Yeah. Totally. Let's go. Jerry, come to rub my face in urine again? Hey. Oh, wow. Okay, is is is everything okay in here? "
121,"Hold on, Morty. Y-you know what? He keeps saying we can run but we can hide. I say we try hiding.","You can run, but you can't hide, bitch! Man, he sure says ""bitch"" a lot! Ooooooaaahhh! Buckle up, bitch! Oh, yeah. We're trying to incept me to get an ""A"" in math? "
122,"Yeah, well, since when are we taking this guy's advice on anything?","But that's the opposite of what- Hold on, Morty. Y-you know what? He keeps saying we can run but we can hide. I say we try hiding. You can run, but you can't hide, bitch! Man, he sure says ""bitch"" a lot! Ooooooaaahhh! Buckle up, bitch! "
123,Worst-case scenario we're back to running.,"Hey, you know what? You got a really good point there, Rick. Like, if the truth was that we could hide, it's not like he'd be sharing that information with us, you know? I-I-I think it's a good idea, Rick. Yeah, well, since when are we taking this guy's advice on anything? But that's the opposite of what- Hold on, Morty. Y-you know what? He keeps saying we can run but we can hide. I say we try hiding. You can run, but you can't hide, bitch! Man, he sure says ""bitch"" a lot! "
124,"Thanks, Morty. Yeah, it's nice to be on the same page every once in a while.","Wow, you know what? I mean, it looks like we could have just hid this whole time. Boy, Rick, that was some good thinking. Worst-case scenario we're back to running. Hey, you know what? You got a really good point there, Rick. Like, if the truth was that we could hide, it's not like he'd be sharing that information with us, you know? I-I-I think it's a good idea, Rick. Yeah, well, since when are we taking this guy's advice on anything? But that's the opposite of what- Hold on, Morty. Y-you know what? He keeps saying we can run but we can hide. I say we try hiding. "
125,"Oh, this is perfect, Morty. Look at that. He's getting sleepy. Just a little bit longer before he calls it a day. That's when we make our move.","You can run But you can't hide! Thanks, Morty. Yeah, it's nice to be on the same page every once in a while. Wow, you know what? I mean, it looks like we could have just hid this whole time. Boy, Rick, that was some good thinking. Worst-case scenario we're back to running. Hey, you know what? You got a really good point there, Rick. Like, if the truth was that we could hide, it's not like he'd be sharing that information with us, you know? I-I-I think it's a good idea, Rick. Yeah, well, since when are we taking this guy's advice on anything? "
126,"Morty, this is perfect. After a little scary coitus, they should be fast asleep and then we'll incept him.","Yeah, I know, I know. I shouldn't take my anger out on you or Scary Brandon. I love you, Melissa. I don't want to talk about it! Huh! You think you can control me with a haircut? You're being very aggressive, Jerry. Perhaps tomorrow Dr. Scraps will solve that problem with a bit of surgery. Well, I'm not calling him that. That's ridiculous. Dad, he wants to be called snowball. "
127,Looks like scary Terry's having a nightmare.,"Morty, this is perfect. After a little scary coitus, they should be fast asleep and then we'll incept him. Yeah, I know, I know. I shouldn't take my anger out on you or Scary Brandon. I love you, Melissa. I don't want to talk about it! Huh! You think you can control me with a haircut? You're being very aggressive, Jerry. Perhaps tomorrow Dr. Scraps will solve that problem with a bit of surgery. Well, I'm not calling him that. That's ridiculous. "
128,"Yeah, this is a bunch of bullcrap. Who cares what stupid pun you make when you kill someone? Why don't you let the poor guy say whatever he wants?","Oh, uh, um ... ""Bitch."" Oh, no! I'm late to class, bitch! Oh, no! I'm not wearing any pants! Oh, boy, Rick. I can only imagine what horrible things must, you know scare Scary Terry. Looks like scary Terry's having a nightmare. Morty, this is perfect. After a little scary coitus, they should be fast asleep and then we'll incept him. Yeah, I know, I know. I shouldn't take my anger out on you or Scary Brandon. I love you, Melissa. "
129,"You're putting too much pressure on yourself, scary Terry. You know, I mean, y-you're perfectly scary enough as it is.","Yeah, this is a bunch of bullcrap. Who cares what stupid pun you make when you kill someone? Why don't you let the poor guy say whatever he wants? Oh, uh, um ... ""Bitch."" Oh, no! I'm late to class, bitch! Oh, no! I'm not wearing any pants! Oh, boy, Rick. I can only imagine what horrible things must, you know scare Scary Terry. Looks like scary Terry's having a nightmare. Morty, this is perfect. After a little scary coitus, they should be fast asleep and then we'll incept him. "
130,"You're our boy, dawg. Don't even trip.","You don't need to say anything. We got you, dawg. Aww, bitch. I don't know what to say. Hey, yo, scary T., don't even trip about your pants dawg. Here's a pair on us, fool. You're putting too much pressure on yourself, scary Terry. You know, I mean, y-you're perfectly scary enough as it is. Yeah, this is a bunch of bullcrap. Who cares what stupid pun you make when you kill someone? Why don't you let the poor guy say whatever he wants? Oh, uh, um ... ""Bitch."" "
131,"As a matter of fact, Terry, there is something you could help us with.","If you guys ever need anything, just say the word. Oh, hey, it's you guys! You're our boy, dawg. Don't even trip. You don't need to say anything. We got you, dawg. Aww, bitch. I don't know what to say. Hey, yo, scary T., don't even trip about your pants dawg. Here's a pair on us, fool. "
132,"Out of the frying pan dot, dot, dot, huh, Morty?","What the hell? Holy crap! God damn! I know one thing for sure I'm giving Morty an ""A"" in math, and that's my idea. That is an original thought. This is because you don't give Morty Smith good grades, bitch! Sex is sacred! These halves don't belong together, bitch! I always hated that song! "
133,"Well, it's possible that your dog became self-aware and made modifications on the cognition amplifier, then turned on Jerry, Beth, and Summer after learning about humanity's cruel subjugation of his species, but your guess is as good as mine, Morty.","Oh, man, what's going on? Out of the frying pan dot, dot, dot, huh, Morty? What the hell? Holy crap! God damn! I know one thing for sure I'm giving Morty an ""A"" in math, and that's my idea. That is an original thought. This is because you don't give Morty Smith good grades, bitch! Sex is sacred! "
